{
  "format": "plclab-exercise",
  "schemaVersion": 1,
  "id": "ex.motor-jog",
  "revision": 1,
  "title": "Motor start/stop (jog)",
  "kind": "practice",
  "difficulty": "beginner",
  "summary": "Run the conveyor motor only while Start is held, the way a setter jogs a belt into position. The normally closed Stop button and the overload relay must always win.",
  "objectives": [
    "Combine a normally open and a normally closed input with AND",
    "Use a feedback contact to show what really happened"
  ],
  "estimatedMinutes": 10,
  "scene": "scene.motor-start-stop",
  "starterProgram": "PROGRAM Main\nVAR_INPUT\n    StartPB : BOOL; (* Start button S1, normally open: TRUE while pressed. *)\n    StopPB : BOOL; (* Stop button S2, normally closed: TRUE while NOT pressed (wire-break safe). *)\n    MotorFeedback : BOOL; (* Contactor auxiliary contact: TRUE when the contactor has pulled in. *)\n    OverloadOK : BOOL; (* Overload relay contact, normally closed: TRUE while the motor is not overloaded. *)\nEND_VAR\nVAR_OUTPUT\n    MotorContactor : BOOL; (* Contactor coil K1: TRUE energizes the motor. *)\n    RunLamp : BOOL; (* Green run lamp H1. *)\nEND_VAR\n\n(* MotorContactor runs while StartPB is held, unless Stop is pressed or the overload tripped. RunLamp shows the contactor feedback. *)\n\nEND_PROGRAM\n",
  "requiredInterface": [
    {
      "tag": "StartPB",
      "type": "BOOL",
      "direction": "input"
    },
    {
      "tag": "StopPB",
      "type": "BOOL",
      "direction": "input"
    },
    {
      "tag": "OverloadOK",
      "type": "BOOL",
      "direction": "input"
    },
    {
      "tag": "MotorFeedback",
      "type": "BOOL",
      "direction": "input"
    },
    {
      "tag": "MotorContactor",
      "type": "BOOL",
      "direction": "output"
    },
    {
      "tag": "RunLamp",
      "type": "BOOL",
      "direction": "output"
    }
  ],
  "instructions": [
    "MotorContactor is TRUE only while Start is held.",
    "Pressing Stop (StopPB becomes FALSE) or an overload (OverloadOK FALSE) switches the motor off even while Start is held.",
    "RunLamp shows the contactor's auxiliary contact MotorFeedback, not the command."
  ],
  "hints": [
    "StopPB is TRUE while Stop is NOT pressed, because the button is normally closed.",
    "MotorContactor := StartPB AND StopPB AND OverloadOK;"
  ],
  "knowledgeRefs": [
    "fundamentals.bool-logic",
    "fundamentals.no-nc-contacts"
  ],
  "evidence": [
    {
      "name": "start",
      "source": {
        "type": "plcTag",
        "tag": "StartPB"
      }
    },
    {
      "name": "stop",
      "source": {
        "type": "plcTag",
        "tag": "StopPB"
      }
    },
    {
      "name": "contactor",
      "source": {
        "type": "plcTag",
        "tag": "MotorContactor"
      }
    },
    {
      "name": "lamp",
      "source": {
        "type": "plcTag",
        "tag": "RunLamp"
      }
    },
    {
      "name": "running",
      "source": {
        "type": "component",
        "component": "motor",
        "quantity": "running"
      }
    }
  ],
  "scenarios": [
    {
      "id": "hold",
      "title": "Hold Start for 2 s",
      "durationMs": 4000,
      "actions": [
        {
          "atMs": 0,
          "action": {
            "type": "setPlcMode",
            "mode": "run"
          }
        },
        {
          "atMs": 500,
          "action": {
            "type": "press",
            "component": "start"
          }
        },
        {
          "atMs": 2500,
          "action": {
            "type": "release",
            "component": "start"
          }
        }
      ]
    },
    {
      "id": "override",
      "title": "Press Stop while Start is held",
      "durationMs": 4000,
      "actions": [
        {
          "atMs": 0,
          "action": {
            "type": "setPlcMode",
            "mode": "run"
          }
        },
        {
          "atMs": 500,
          "action": {
            "type": "press",
            "component": "start"
          }
        },
        {
          "atMs": 3000,
          "action": {
            "type": "release",
            "component": "start"
          }
        },
        {
          "atMs": 1500,
          "action": {
            "type": "press",
            "component": "stop"
          }
        },
        {
          "atMs": 2000,
          "action": {
            "type": "release",
            "component": "stop"
          }
        }
      ]
    }
  ],
  "criteria": [
    {
      "id": "runs",
      "title": "The motor runs while Start is held",
      "points": 30,
      "scenario": "hold",
      "rule": {
        "type": "respondsWithin",
        "trigger": {
          "type": "compare",
          "signal": "start",
          "layer": "inputs",
          "op": "eq",
          "value": true
        },
        "response": {
          "type": "compare",
          "signal": "contactor",
          "layer": "outputs",
          "op": "eq",
          "value": true
        },
        "withinMs": 200
      },
      "onFail": "MotorContactor did not follow the held Start button."
    },
    {
      "id": "releases",
      "title": "The motor stops when Start is released",
      "points": 30,
      "scenario": "hold",
      "rule": {
        "type": "stateAt",
        "atMs": 3000,
        "condition": {
          "type": "compare",
          "signal": "contactor",
          "layer": "outputs",
          "op": "eq",
          "value": false
        }
      },
      "onFail": "The motor kept running after Start was released. A jog must not latch."
    },
    {
      "id": "stop-wins",
      "title": "Stop overrides a held Start",
      "points": 25,
      "scenario": "override",
      "rule": {
        "type": "stateAt",
        "atMs": 1800,
        "condition": {
          "type": "compare",
          "signal": "contactor",
          "layer": "outputs",
          "op": "eq",
          "value": false
        }
      },
      "onFail": "The motor kept running while Stop was pressed."
    },
    {
      "id": "lamp",
      "title": "RunLamp shows the real contactor state",
      "points": 15,
      "scenario": "hold",
      "rule": {
        "type": "stateAt",
        "atMs": 1500,
        "condition": {
          "type": "compare",
          "signal": "lamp",
          "layer": "outputs",
          "op": "eq",
          "value": true
        }
      },
      "onFail": "RunLamp was off while the contactor was pulled in."
    }
  ]
}
